datasetID,Filename,Author,Year,Title,Journal,Volume,Pages,AssignedTo,EnteredBy,ToDo,Notes,URL,Var,Status,BBCH,Woody,Spp,Measurement Notessanzperez10,Sanz-Perez_2010_Trees.pdf,"Sanz-Perez V., Castro Diez P.",2010,Summer water stress and shade alter bud size and budburst date in three mediterranean Quercus species,Trees ,24,89-97,AE,AE,Fig 5.,budburst of three oak species under different water and light conditions; focus on light,,percentbudburst,k,y,y,"Quercus coccifera, Quercus ilex, Quercus faginea",savage13,Savage_2013_Ecology.pdf,"Savage J., Cavender-Bares J.",2013,Phenological cues drive an apparent trade-off between freezing tolerance and growth in the family Salicaceae,Ecology,94,1708-1717,,,,Ask Jessica for data! She has budburst in two climates for many Salix spp,,,,,,,schaber03,Schaber_2003_IntJBiometeorol.pdf,,2003,,,,,,,,Observation and modeling only,,,n,,,,scheiber06,Schieber_2006_JForestSci.pdf,,2006,,,,,,,,Observational study at different stocking rates only,,,n,,,,schier78,Schier_1978_ForestScience.pdf,,1978,,,,,,,,Ethylene experiment on shoot growth only,,,n,,,,schmitz14,Schmitz_2014_AmrcnJrnBotany.pdf,Schmitz J.D. et al. (Lauri),2014,Exploring bud dormancy completion with a combined architectural and phenological analysis: the case of apple trees in contrasting winter temperature conditions1,Am J Bot,101,398-407,,,,Bud anatomy study,,,n,,,,schmitz15,Schmitz_2015_ScientiaHort.pdf,,2015,,,,,,,,"Comparison of nodes of different position, not env conditions",,,n,,,,schnaebel87,Schnaebel_1987_JEnology.pdf,"Schnabel B.J., Wample R.L.",1987,Dormancy and cold hardiness in Vitis vinifera L. cv. White Riesling as influenced by photoperiod and temperature,Am J Enology Viticulture,38,265-272,AE,AE,Fig 7,,,daysto50%budburst,k,,,,schuch88,Schuch_1988_CanJrnlFrstRsrch.pdf,,1988,,,,,,,,Damage to needles only,,,n,,,,schwartz10,Schwartz_2010_IntJrnlClimatology.pdf,,2010,,,,,,,,Observation of chilling accumulation,,,n,,,,skre08,Skre_2008_EnvExpBot.pdf,Skre,2008,The importance of hardening and winter temperature for growth in mountain birch populations,Environ Exp Bot,62,254-266,DF,DF,Fig 8: budbreak by temperature treat and origin,,,daystobudburst,k,y,y,Betula pendula,skuterud94,Skuterud_1994_SilvaFen.pdf,"Skuterud R., Dietrichson J.",1994,Burburst in detached birch shoots (Betula pendula) of different varieties winter-stored in darkness at thre different temperatures,Silva Fennica,28,233-241,AE,AE,Fig 3 (3D!),,,daystobudburst,k,y,y,Betula pendula,sogaard08,Sogaard_2008_TreePhys.pdf,"Sogaard, G., Johnsen O, Nilsen J., Junttila O.",2008,Climatic control of bud burst in young seedlings of nine provenances of Norway spruce,Tree Physiology,28,311-320,AE,AE,"Fig 1, 2, 3",Three experiments,,,k,y,y,Picea abies,spann04,Spann_2004_JAmSocHortSCi.pdf,Spann,2004,Photoperiod and Temperature Effects on Growth and Carbohydrate Storage in Southern Highbush Blueberry Interspecific Hybrid,J Am Soc Hortic Sci,129,294-298,AE,AE,Fig 1,,,percentflowering,k,y,y,Vaccinium corymbosum,sutinen12,Sutinen_2012_TreePhys.pdf,,2012,,,,,,,,Bud anatomy study,,,n,,,,takimoto64,Takimoto_1964_PlantPhysiol.pdf,Takimoto,1964,Effect of temperature and preconditioning on photoperiodic response of Pharbitis nil,Plant Physiol,39,1024-1030,TS,TS,Fig 1,"Scraped, need to fill in ""study"" details sheet",,,e,y,n,Pharbitis nil (Convulvaceae),thabeet09,Thabeet_2009_Trees.pdf,,2009,,,,,,,,Observational study,,,n,,,,thielges75,Thielges_1975_conf.pdf,"Thielges, B.A., Beck R.C.",1975,Control of bud break and its inheritance in Populus deltoides,Tree Physiology and Yield improvement,,,AE,AE,Fig 1.,Chilling study,,daystobudburst,k,y,y,Populus deltoides,thorup57,Thorup_1957_PhysPlant.pdf,,1957,,,,,,,,Ethylene study,,,n,,,,vasilakakis79,Vasilakakis_1979_JAmHortSciSoc.pdf,VASILAKAKIS,1979,TEMPERATURE AND DEVELOPMENT OF RED RASPBERRY FLOWER BUDS,J Am Soc Hort Sci ,104,61-62,,TS,,Hand drawings of raspberry bud initiation under GA,,,n,n,y,Rubus idaeus,viheraaarno06,Vihera_-Aarnio_2006_TreePhys.pdf,"Vinhera-Aarino A., Hakkinen R., Junttila O.",2006,Critical night length for bud set and its variation in two photoperiodic ecotypes of Betula pendula,Tree Physiology,26,1013-1018,TS,TS,Fig 1,,,percentbudset,e,n,y,,"A seedling was recorded as having set bud if no leaves or only one small leaf had formed at the shoot apex during the preced- ing week and if the uppermost leaf differed considerably in size from that immediately below. If there was an even contin- uum of leaves of varying size at the top of the seedling, it was assumed to be still growing. At the end of the experiment, the number of seedlings with set buds was counted and the per- centage of seedlings with set buds calculated for each treat- ment and mother tree."viheraaarno13,Vihera_-Aarnio_2013_TreePhys.pdf,"Viherä-Aarnio, Sutinen, Partanen, Hakkinen",2006,Internal development of vegetative buds of Norway spruce trees in relation to accumulated chilling and forcing temperatures,Tree Physiology,34,547-556,,,,Bud anatomy study,,,n,,,,vitasse09a,Vitasse_2009_AgForestMeteorology.pdf,Vitasse Y. et al. (Michalet),2009,Leaf phenology sensitivity to temperature in European trees: Do within-species populations exhibit similar responses?,Agricultural and Forest Meteorology,149,735-744,,,,doy by altitude study for multiple species.,,,m,,,,vitasse09b,Vitasse_2009_Oecolgia.pdf,,2009,,,,,,,,doy by altitude study for multiple species.,,,m,,,,vitasse11,Vitasse_2011_AgForestMeteorology.pdf,,2011,,,,,,,,Modeling study of observed data,,,n,,,,vitasse13a,Vitasse_2013_EuroJrnlForestResearch.pdf,,2013,,,,,,,,Review article,,,n,,,,vitasse13b,Vitasse_2013_NewPhyto.pdf,,2013,Ontogenic changes rather than difference in temperature cause understory trees to leaf out earlier,,,,,,,"Comparison of seedlings at different heights in canopy, interesting but not for us",,,m,,,,vitasse14a,Vitasse_2014_FrntrsPlantSci.pdf,,2014,,,,,,,,"Think-piece, no experimental data",,,n,,,,vitasse14b,Vitasse_2014_JournalofEcology.pdf,,2014,Earlier leaf-out rather than difference in freezing resistance puts juvenile trees at greater risk of damage than adult trees,,,,,,,Freezing resistance study only,,,n,,,,vitasse14c,Vitasse_2014_Tree Physiol.pdf,,2014,,,,,,,,"Comparison of cuttings and adults, but no experimental treatments shown",,,n,,,,vonwuehlsich96,VonWuehlisch_1996_SilvaeGenetica.pdf,,1996,,,,,,,,budburst data not shown,,,n,,,,way11,Way_2011_TreePhysiol.pdf,,2011,,,,,,,,Review paper,,,n,,,,way14,Way_2014_PlantCellEnv.pdf,,2014,,,,,,,,Review paper,,,n,,,,weller12,Weller_2012_PNAS.pdf,,2012,,,,,,,,genetics of photoperiodism study,,,n,n,n,,welling02,Welling_2002_PlantPhysiol.pdf,"Welling A., Moritz T., Palva E.T., Junttila O.",2002,Independent Activation of Cold Acclimation by Low Temperature and Short Photoperiod in Hybrid Aspen,Plant Physiol,129,1633-1641,,,,"Growth, not budburst, but could use",,Elongation,m,,,,wesolowski06,Wesolowski_2006_ForestEco&Mngmnt.pdf,,2006,,,,,,,,Observational study,,,n,,,,wielgolaski99,Wielgolaski_1999_IntJBiomet.pdf,,1999,,,,,,,,Observational study,,,n,,,,willoughby05,Willoughby_2005_ForestEcoMngmnt.pdf,"Willoghby I., Dixon F.L., Clay D.V.",2005,Dormant season vegetation management in broadleaved transplants and direct sown ash (Fraxinus excelsior L.) seedlings,Forest Ecol Management,222,418-426,,,,herbicide application study,,,n,,,,worall83,Worrall_1983_SilvaeGenetica.pdf,Worrall J.,1983,Temperature - Budburst relationships in Amabilis and Subalpine fir provenace tests replicated at different elevations,Silvae Genetica,32,5-6,DF,,,elevational study,,,m,,,,worall93,Worrall_1993_JSustFor.pdf,,1993,,,,,,,,Observational study,,,n,,,,worrall67,Worrall_1967_PhysiologiaPlant.pdf,"Worrall J., Mergen F.",1967,Environmental and genetic control of dormancy in Picea abies,Physiologia Plantarum,20,733-745,TS,TS,,,,,e,,,,zohner14,Zohner_2014_EcoLetters.pdf,"Zohner C., Renner S.S.",2014,"Common garden comparison of the leaf-out phenology of woody species from different native climates, combined with herbarium records, forecasts long-term change",Ecology Letters,,,,,,"Common garden study, all data in supplemental info",,,n,,,,zouaoui14,Zouaoui_2014_PakistanJrnlofBot.pdf,,2014,,,,,,,,Observational study,,,n,,,,