datasetID,Filename,Author,Year,Title,Journal,Volume,Pages,AssignedTo,EnteredBy,ToDo,Notes,URL,Var,Status,BBCH,Woody,Spp,Measurement Notesaalders64,,"AALDERS, L. E.; HALL, I. V.",1964,"A comparison of flower-bud development in the lowbush blueberry, Vaccinium angustifolium Ait. under greenhouse and field conditions",PROC AMER SOC HORT SCI,85,281-284,,,,ILL request,,,,,,,andreini10,,"Andreini, L. et al. ",2010,Morpho-Anatomical Observations during Bud Break in Vitis vinifera L,Viii Int Symp,872,,,,,,,,,,,,augspurger09,Augspurger_2009_FunctEcology.pdf,"Augspurger, C.K.",2009,"Spring 2007 warmth and frost: phenology, damage and refoliation in a temperate deciuous forest",Functional Ecology,23,1031-1039,AE,,,,,phenological stage,k,Y,,,bailey06,Bailey_2006_TreePhys.pdf,"Bailey, J.D. et al.",2006,"Temperature regulation of bud-burst phenology within and among years in a young Douglas-fir (Pseudotsuga menziesii) plantation in western Washington, USA ",Tree Physiology,26,421-430,DF,,,table 1 contains measurement key,,daystobudburst,k,y,,,basler12,Basler_2012_AgrForMet.pdf,"Basler D, Körner C",2012,Photoperiod sensitivity of bud burst in 14 temperate forest tree species,Agricultural and Forest Meteorology,165,73-81,,TS,"Fig 3, Fig 4","Scraped, need to fill in ""study"" details sheet",,daystobudburst,e,y,y,,basler14,Basler_2014_TreePhys.pdf,"Basler D, Körner C",2014,Photoperiod and temperature responses of bud swelling and bud burst in four temperate forest tree species,Tree Physiology,34,377–388,,TS,Entering into data_simple 02-02,measurement key highlighted on pg 379 ,,daystobudburst,e,y,y,,bauerle12,Bauerle_2012_PNAS.pdf,"Bauerle, W.L. et al.",2012,"Photoperiodic regulation of the seasonal patternof photosynthetic capacity and the implicationsfor carbon cycling",PNAS,109,8612–8617,,,,"More concerned with photosynthetic capacity. ""Bud"" only mentioned once in paper.",,"photosynthetic capacity, LSI",n,n,,,bernier81,,"Bernier G, Kinet JM, Sachs RM",1981,"The Physiology of Flowering, Vol. 1","CRC Press, Boca Raton ",,,,TS,,"From CRC handbook, pdf of one figure",,,e,,,,besford96,Besford_1996_TreePhys.pdf,Besford et al.,1996,Photoperiod effect on bud burst in Prunus is phase dependent: significance for early photosynthetic development,Tree Physiology,16,491-496,,TS,Table 1,,,percentbudburst,e,y,,,biasi12,Biasi_2012_Actahort.pdf,"Biasi, LA, Zanette F, Carvalho RIN",2012,Dormancy Dynamics of Grape and Kiwifruit Buds in a Region of Low Chill Occurrence,Acta Horticulturae,932,507-512,DF,DF,,"Data displayed in tables at end of paper, not charts",,"average budbreak time, final budbreak rate",k,m,y,"Niagara branca grape, Bruno kiwifruit",biran73,Biran_1973_PhysiolPlant.pdf,"Biran I, Halevy AH",1973,The relationship between rooting of Dahlia cuttings and the presence and type of bud ,Physiologia Plantarum,28,244-247,DF,DF,,,,budlength,k,n,n,Dahlia,blackman11,Blackman_etal_2011.pdf,Blackman et al.,2011,Connecting the sun to flowering in sunflower adaptation,Molecular Ecology,20,3503-3512,,,Fig 1b,"More concerned with particular trait, gene expression",,trait expression,n,n,n,Sunflower,burner14,Burner_2014_AgroforestSystms.pdf,"Burner, M.D. et al.",2014,Phenological responses of juvenile pecan and white oak on an upland site,Agroforest Syst,88,141-155,AE,,,Test of an upland site,,daystobudburst,k,n,y,"Carya illinoiensis, Quercus alba",caffarra11b,Caffarra_2011_ClimRes.pdf,"Caffarra, A. et al.",2011,Modelling the timing of Betula pubescens budburst. I. Temperature and photoperiod: a conceptual model,Clim Res,46,147-157,,TS,,,,daystobudburst,e,y,y,Betula pubescens,cafferra11a,Caffarra_2011_IntJBiometeor.pdf,"Caffarra A, Donnelly A",2011,The ecological significance of phenology in four different tree species: effects of light and temperature on bud burst,Int J Biomet,55,711-721,,TS,"Fig 1, Fig 2, Fig 3, Fig 4",First entry of summer 2015. Added a Study column to data sheets.,,"daystobudburst, percentbudburst",e,m,y,"Betula pubescens, Salix smithiana, Fagus sylvatica, Tilia cordata",campbell75,Campbell_1975_BotGaz.pdf,"Campbell RK, Sugano AI",1975,"Phenology of bud burst in Douglas-fir related provenance, photoperiod, chilling, and flushing temperature",Botanical Gazette,136(3),290-298,EMW,EMW,,,,daystobudburst,k,m,y,Pseudotsuga menziesii,campoy10,Campoy_2010_SAJrnlBotany.pdf,"Campoy, J.A. et al.",2010,Clinical variation of dormancy progression in apricot,SA J Botany,77,618-630,BF,,,,,daystobudburst,k,y,y,Apricot,campoy11,Campoy_2011_ScientiaHort.pdf,"Campoy, J.A. et al.",2011,High temperatures and time to budbreak in low chill apricot ‘Palsteyn’. Towards a better understanding of chill and heat requirements fulfilment,Sci Hort,129,649-655,JS,,,,,daystobudburst,k,y,y,Apricot,cannell83,Cannell_1983_AppliedEco.pdf,"Cannell, M.G.R. and Smith, R.I.",1983,"Thermal time, chill days and prediction of budburst in Picea sitchensis",J App Eco,20,951-963,EF,,,"The treatments (photoperiod, provenance and time planted outside) were all reported together and therefore can't scrape the data - discussed with Dan and he agreed that it was not usable. ",,"days to budburst, degree days,  growth rate, mean bud length",k,m,y,Picea sitchensis,carvalho10,Carvalho_2010_RevistaBrasFrut.pdf,"Carvalho, R.I.N. et al.",2010,Endodormancy of peach and plum tree buds in a region of low chill occurrence,Rev Bras Frutic,32(3),769-777,,,,Paper written in Portuguese,,––,n,m,m,––,carvalho14,Carvalho_2014_ActaSciAgronomy.pdf,"Carvalho, R.I.N. et al.",2014,Dormancy of 'Imperial Gala' apple and 'Hosui' pear tree buds in a region of low chill occurrence,Acta Sci Agro,36(4),429-434,,,,Paper written in Portuguese,,––,n,m,m,––,charrier11,Charrier_2011_IntJrnBiomet.pdf,"Charrier, G. et al.",2011,"Are budburst dates, dormancy and cold acclimation in walnut trees (Juglans regia L.) under mainly genotypic or environmental control?",Int J Biomet,55(6),763-774,,TS,,Variable is in hours but could be calaculated into days.,,daystobudburst,e,y,y,Juglans regia,chuine00,Chuine_2000_JTheorBio.pdf,"Chuine, I.",2000,A unified model for budburst of trees,J Theor Biol,207,337-347,,,,"No observational experiment, just model testing",,––,n,––,––,––,chuine99,Chuine_1999_NewPhyt.pdf,"Chuine, I. and Cour, P.",1999,Climatic determinants of budburst seasonalityin fourtemperate-zonetree species,New Phytol,143,339-349,,,,"Outdoor experiment, may not be good.",,daystobudburst,m,m,y,"Platanus Acerifolia, Vitis vinifera, Quercus","Phenologicalstagewas recordedonce a week fromthe beginningof the experimentto the firststageand thenthreetimesa week at each site accordingtothefollowingscale: 1,slightlyswollen; 2, swollen; 3, leaves visible in the bud; 4, leaves completely unfolded. A stage was considered reached on the Julian date when 50% of the buds of each seedling fulfille the criterion."clark12,Clark_2012b_GlblChngBio.pdf,"Clark, J.S. et al.",2012,The seasonal timing of warming that controls onset of the growing season,Global Change Biology,20,1136-1145,,,,Looks like open top chambers at HF and Duke. Growth guide on pg 1141,,sensitibitytowarming,m,y,y,15 tree species,clark14,Clark_2014_FnctEcol.pdf,Clark et al.,2014,"Tree phenology responses to winter chilling, spring warming, at north and south range limits",Functional Ecology,28,1344-1355,,,Fig 1,Looks like open top chambers at HF and Duke. Growth guide on pg 1348,,various,m,y,y,15 tree species,collin99,Collin_1999_AnnalsofBotany.pdf,"Collin, P. et al.",1999,Growth responses of common ash seedlings (Fraxinus excelsior L.) to total and partial defoliation,Annals of Botany,85,317-323,,,,Defoliation treatment might not be good for this analysis,,stemelongation,n,n,y,Fraxinus excelsior ,colombo98,Colombo_1998_ForestryJ.pdf,"Colombo, S.J. et al.",1998,Climatic warming and its effect on bud burst and risk of frost damage to white spruce in Canada,Forestry Chronicle,74(4),567-577,-,-,,"Predictions from long-term data only, no controlled experiment",,daystobudburst,n,n,y,Picea glauca,cook00a,Cook_2000_ScientiaHort.pdf,"Cook, N.C. and Bellstedt, D.U.",2000,Chilling response of 'Granny Smith' apple lateral buds inhibited by distal shoot tissues,Sci Hort,89,299-308,,,,Bud inhibition treatment,,daysto50%budburst,m,m,y,Malus domestica,cook00b,Cook_2000_JrnlHortSciBiotech.pdf,"Cook, N.C. et al.",2000,Progression of apple (Malus x domestica Borkh.) bud dormancy in two mild winter climates,J Hort Sci Biotech,75(2),233-236,JS,JS,,20% budburst might not be great for analysis,,daysto20%budburst,k,m,y,Malus domestica,cook05,Cook_2005_ScientiaHort.pdf,"Cook, N.C. et al.",2005,Freezing temperature treatment induces bud dormancy in ‘Granny Smith’ apple shoots,Sci Hort,106,170-176,,TS,,Freezing treatment,,daysto50%budburst,m,m,y,Malus domestica,cronje03,Cronje__2003_AdvHortSciences.pdf,"Cronjé, P.J.R. et al.",2003,Quantification of the dormancy progression in terminal apple buds. Changes in growth rate and water status,Adv Hort Sci,17(2),105-110,DF,DF,,Diagram difficult to read,,daysto25%budburst,m,m,y,Malus sylvest,dantec14,Dantec_2014_IntJBiom.pdf,Dantec et al.,2014,Chilling and heat requirements for leaf unfolding in European beech and sessile oak populations in the southern limit of their distribution,Int J Biomet,,,DF,DF,"Fig 1, Fig 2",Specifically used BBCH guide. But experiment is outdoors/uncontrolled,,"daystoleafunfolding, growingdegreedays",k,y,y,"Fagus sylvatica, Quercus petraea",danusevicius01,Danusevicius_2001_ScandJForRes.pdf,"Danusevicius, D. and Gabrilavicius, R.",2001,Variation in juvenile growth rhythm among Picea abies provenances from the Baltic states and the adjacent region,Scand J For Res,16,305-317,,,,Growth stage rubric detailed on page 307. No outstanding figures or tables,,frostdessicationdamage,m,y,y,Picea abies,decarvalho10,deCarvalho_2010_MolecEco.pdf,"de Carvalho, D. et al.",2010,"Admixture facilitates adaptation from standing variation in the European aspen (Populus tremula L.), a widespread forest tree",Molecular Ecology,19,1638-1650,,,,"Looking at traits, not a good match",,traitexpression,n,n,y,Populus tremula,devries82,DeVries_1982_SciHort.pdf,De Vries,1982,"Interaction of temperature and light on growth and development of hybrid tea-rose seedlings, with reference to breeding for low-energy requirements",Scientia Horticultura,17,377–382,,TS,"Fig 1, Fig 2, Fig 3",Days to a flower bud. Interesting experiment on irradiance,,"daystoflowerbudappearance, percentflowering, daystoanthesis",e,y,y,Tea rose,"Each seedling was observed until flower bud abortion or anthesis occurred."donoho57,Donoho_1957_Science.pdf,"Donoho, C.W. and Walker, D.R.",1957,Effect of gibberellic acid on breaking of rest period in Elberta peach,Science,126,1178-1179,,,,Agricultural experiment studying effect of particular acid. Not a good match.,,percentleavesgrowing,n,n,n,Phytophthora infestan,dunn00,Dunn_2000_AustJrnlGrapeWine.pdf,"Dunn, G.M. and Martin, S.R.",2000,Do temperature conditions at budburst affect flower number in Vitis vinifera L. cv. Cabernet Sauvignon?,Aus J Grape Wine Res,6,116-124,,,,Outdoor experiment with variable temperature. Tested pruning times and acid application.,,"numberofbuds, flowersperinflorescence",m,n,y,Vitis vinifera,dunstone80,,Dunstone RL,1980,Jojoba flower buds: temperature and photoperiod effects in breaking dormancy,Aust J Agric Res,31,727-737,,,,,,,,,,,dunsworth88,Dunsworth_1988_Conf.pdf,"Dunsworth, B.G.",1988,Impact of lift date and storage on field performance for Doublas-Fir and Western Hemlock,,,,,,,"Lots of treatments going on here, not a good match.",,various,n,m,y,"Douglas Fir, Western Hemlock",ellis97,Ellis_1997_AnnBot.pdf,"Ellis, R.H.",1997,"Effects of photoperiod, temperature and asynchrony between thermoperiod and photoperiod on development to panicle initiation in sorghum",Annals of Botany,79,169-178,,TS,,"Already entered, but actually will exclude (non woody)",,,n,n,n,Sorghum,falusi03,Falusi_2003_PlantBiosys.pdf,"Falusi, M. and Calamassi, R.",2003,Dormancy of Fagus sylvatica L. buds III. Temperature and hormones in the evolution of dormancy in one-node cuttings,Plant Biosys,137(2),185-192,,TS,,,,percentbudsburst,e,y,y,Fagus sylvatica,falusi90,Falusi_1990_TreePhys.pdf,"Falusi M, Calamassi R",1990,Bud dormancy in beech (Fagus sylvatica L.). Effect of chilling and photoperiod on dormancy release of beech seedlings,Tree Physiology,6,429-438,,TS,"Table 1, Table 2, Fig 1, Fig 2 at least",,,"percentbudsburst, apicalbudgrowth, shootlength, ",e,y,y,Fagus sylvatica,falusi96,Falusi_1996_AnnSciFor.pdf,"Falusi M, Calamassi R",1996,Geographic variation and bud dormancy in beech seedlings (Fagus sylvatica L),Ann Sci For,53,967-979,,TS,"Fig 1, Fig 2, Fig 3, Fig 4","Used Scale of Malaisse, detailed on pg 969",,percentbudsburst,e,y,y,Fagus sylvatica,"Sprouting was scored on the scale of Malaisse (1964). Only the first three stages were utilized in this study (stage 1: fusi- form elongated buds, 2: buds are swollen and somewhat lengthened, 3: bud scales have sep- arated and the green tips of the first leaves are emerging) while the other four stages were not used because they were not pertinent to this work. Shoot development w a s defined by the two parameters of length of the new shoot from the bud and the number of leaves produced."falusi97,Falusi_1997_PlantBiosys.pdf,"Falusi, M. and Calamassi, R.",1997,Bud dormancy in Fagus sylvatica L. II. The evolution of dormancy in seedlings and one-node cuttings,Plant Biosys,131(2),143-148,EF,EF,Fig 2 or Tables,,,percentbudsburst,k,y,y,Fagus sylvatica,faquim07,Faquim_2007_RevBrasdeFrut.pdf,"Faquim, R. et al.",2007,CHILL REQUIREMENT FOR BUD BREAK OF JAPANESE PERSIMMON CV. FUYU,Rev Bras Frutic,29(3),438-444,,,,Paper written in Portuguese,,––,n,m,m,––,fila2012,Fila_2012_AgriForestMtrlgy.pdf,"Fila, G. et al.",2012,Calibration and validation of grapevine budburst models using growth-room experiments as data source,Agricultural and Forest Meteorology,160,69-79,DF,,,"Good growth chamber study, but no scrapable data",,daystobudburst,n,m,y,Vitis vinifera,finetto01,Finetto_2001_ActaHort.pdf,"Finetto, G.A.",2001,The effect of low temperatures on the dormancy of three apple cultivars in the Po Valley,Acta Horticulturae,565,141-149,EF,,Table 1,,,daysto50%budburst,k,m,y,Malus,floistad10,Floistad_2010_CanJForRes.pdf,"Fløistad, I.S. and Granhus, A.",2010,Bud break and spring frost hardiness in Picea abies seedlings in response to photoperiod and temperature treatments,Can J For Res,40,968-976,JS,,Table 3,"Good short day, long day style experiment here",,"daysto50%budburst, daystobudformation, various",k,y,y,Picea abies,foley09,Foley_2009_Botany.pdf,"Foley, M.E. et al.",2009,"The effects of temperature, photoperiod, and vernalization on regrowth and flowering competence in Euphorbia esula (Euphorbiaceae) crown buds",Botany,87,986-992,,,,"Study of a weed's flowering and shoot height, maybe not good match",,"percentflowering, shoot height",m,m,weed,Eurphorbia esula,fracheboud09,Fracheboud_2009_PlantPhys.pdf,"Fracheboud, Y. et al.",2009,The control of autumn senescence in European aspen,Plant Phys,149,1982-1991,,,,"Study of fall senescence and budset times, not spring leafout",,"daystosenescence, daystobudset",n,m,y,Populus tremula,fu12,Fu_2012_PLoSOne,"Fu, YH et al.",2012,The Impact of Winter and Spring Temperatures on Temperate Tree Budburst Dates: Results from an Experimental Climate Manipulation,PLoS One,7,e47324,JS,,Figure 4 (obs budburst only),Growth stage rubric detailed on page 3,,daystobudburst,k,y,y,"Fagus sylvatica, Betula pendula, Quercus robur",fu13,Fu_2013_AgricForestMetr.pdf,"Fu, YH et al.",2013,Sensitivity of leaf unfolding to experimental warming in three temperate tree species,Agricultural and Forest Meteorology,181,125-132,EF,EF,Figure 2,Growth stage rubric detailed on page 126,,daystoleafunfolding,k,y,y,"Fagus sylvatica, Betula pendula, Quercus robur",gansert02,Gansert_2002_ArcticAlpRes.pdf,"Gansert, D.",2002,"Betula ermanii, a dominant subalpine and subarctic treeline tree species in Japan: ecological traits of deciduous tree life in winter","Arctic, Antarctic, and Alpine Research",34,57-64,DF,DF,Figure 4,"Mostly measuring frost hardiness, except for Figure 4",,daystobudburst,k,y,y,Betula ermanii,"The course of bud phenology of B. ermanii was investi- gated from late March 1997 to late June 1998. Nine phenological stages were differentiated(Murrayet al., 1989; Heide, 1993): buds closed [0], slightly swollen [1], swollen [2], green foliage showing [3], early elongation [4], advancedelongation [5], early frondescence [6], advanced frondescence [7] and frondescence terminated[8]. At each sampling date, 30 vegetative buds were collected randomlyfrom shoots of the uppercrown of each of the sample trees and classified according to their phenological stages. All buds per sampling date and study site were treated as a composite sample. "ghelardini06,Ghelardini_2006_CanadianJrnl.pdf,"Ghelardini, L., Falusi M., Santini A.",2006,Variation in timing of bud-burst of Ulmus minor clones from different geographical origins,Can J For Res,36,1982-1991,DF,DF,Fig 5 c and d,Good study but tests different locations,,daystobudburst,k,y,y,Ulmus minor,"Phenological notations were taken for each tree according to a common protocol from Feb to May at least once a week using a three-step scale (1, dormant buds; 2, buds swollen, but scales closed; 3, bud scales open, and the extremeties of the first leaf visible at the apex of the buds). For each individual tree, the budburst date (BBD) was defined as the day since Jan 1 (Julian day), when one-half of the lateral buds had reached stage 3..."ghelardini07,Ghelardini_2007_Thesis.pdf,"Ghelardini, L.",2007,"Bud Burst Phenology, Dormancy Release and Susceptibility to Dutch Elm Disease in Elms (Ulmus spp.)","Swedish University of Agricultural Sciences, Uppsala",,,,,,,,"degreedays, thermaltimetodbudburst",n,m,y,Ulmus spp.,ghelardini10,Ghelardini_2010_TreePhysiol.pdf,"Ghelardini, L.",2010,Bud dormancy release in elm (Ulmus spp.) clones––a case study of photoperiod and temperature responses,Tree Physiology,30,264-274,,TS,,,,percentbudburst,e,m,y,Ulmus spp.,"Assessment of bud burst and statistical analysesIn both experiments, all the buds were scored for bud burst every other day until the end of the growth chamber treatments, which were terminated after accumulation of 1050 day degrees (dd) >0 °C, i.e., after 50, 40 and 75 days at 21 (Ex- periment 1), 26 and 14 °C (Experiment 2), respectively. Bud burst was defined as Stage 3 according to Murray et al. (1989) phenological scale: 1 = slightly swollen; 2 = swollen; 3 = green foliage showing; 4 = elongating. Individual twigs were recorded as flushing on the average bud burst date among all their buds. Percentage bud burst (PB) and thermal time (TT) to bud burst (dd > 0 °C) were calculated for each treatment in both experiments."gomory15,Go_mo_ry_2015_EurJForestRes.pdf,"Gomory, D., Foffova E., Longauer R., Krajmerova D.",2015,Memory effects associated with early-growth environment in Norway spruce and European larch,Eur. J Forest Res,134,89-97,EF,EF,"Figure 1 a and b, Figure 2 and b",,,daystobudburst,k,y,y,"Picea abies, Larix decidua","1 Dormant bud without signs of flushing2 Bud slightly elongated, minor separation of terminal bud scales3 Elongated, swollen bud with scale separation throughout the bud4 Bud strongly swollen, tips of needles emerging5 Protruding needles reaching the length of the bud 6 Fully ruptured bud7 Start of shoot elongation"gould12,Gould_2012_TreePhys.pdf,"Gould, P.J., Harrington, C.A., St. Clair, J.B.",2012,Growth phenology of coast Douglas-fir seed sources planted in diverse environments,Tree Physiology,32,1482-1496,,,,"Looks to be multiple in situ study, may not be a good match",,"daysto50%budburst, cumulativegrowth, heightgrowth, ",n,m,y,Pseudotsuga menziesii,granhus09,Granhus_2009_TreePhysiol.pdf,"Granhus, A., Floistad I.S., Gunnhild S.",2009,Bud burst timing in Picea abies seedlings as affected by temperature during dormancy induction and mild spells during chilling,Tree Physiology,29,497-503,EMW,EMW,"Fig 2 A (diff temp, across origins)",Growth stage rubric detailed on pg 498-499,,"daystobudburst, percentstage2, percentburst",k,y,y,Picea abies,"Terminal bud set was recorded three times per week on all seedlings in four pots from each replicate and DT temper- ature (12 and 21 °C). The recordings continued until all seedlings had formed a tiny white bud, corresponding to Stage 1 in the scheme presented by Johnsen (1989). The progress of bud burst was recorded at the end of each MS period, and three times per week during forcing. The following scale, modified from Krutzsch (1973), was used: (1) dormant, (2) marked swelling and gray-green bud color, (3) needle tips emerging through bud scales and (4) elongation of needles to about double bud length. A seedling was considered to have burst bud on reaching Stage 3. The bud burst recordings were terminated after 140 days."guak98,Guak_1998_TreePhys.pdf,"Guak S., Olsyzk D.M., Fuchigami L.H., Tingey D.T.",1998,Effects of elevated CO2 and temperature on cold hardiness and spring bud burst and growth in Douglas-fir (Pseudotsuga menziesii),Tree Physiology,18,671-679,JS,,"Fig 5, possibly Fig 6.",Extra treatment of elevated CO2. Growth stage rubric detailed on pg 673.,,"daystobudburst, daysto30%budburst",k,m,y,Pseudotsuga menziesii,"Leader buds (14 trees per replication) were examined on March 4 and weekly from March 18 until June 3, 1996. Branch terminal buds (four trees per replication) were monitored at 3-day intervals from mid-February to mid-May. Time of bud burst was determined as the date that green needles emerged ≈ 2 mm through scales from leader buds and branch terminal buds. For leader buds, time of bud burst was determined from the mean of those buds that had burst by June 3, 1996, whereas for the branch terminal buds, mean date to 30% bud burst (DBB 30% ) was determined from regressions of % bud burst and time. New shoot growth was measured on June 3, 1996."gunderson12,Gunderson_2012_GlbChngBio.pdf,"Guderson C.A., et al.",2012,Forest phenology and a warmer climate – growing season extension in relation to climatic provenance,Global Change Biology,18,2008-2025,EF,EF,"Fig 1, 2a + b possibly",Growth stage rubric detailed on pg 2011. Open top chambers.,,unique score,k,y,y,"Liquidambar styraciflua, Quercus rubra, Populus grandidentata, Betula alleghaniensis","A scale from 1 (no bud activity) to 6 (leaves flat and expanded) was used, adapted from the phenological stages of maple in Norby et al. (2003). At stage 2, buds were swollen; at 3, buds were just open and leaf tips were beginning to emerge. At stage 4, leaves had fully emerged from the buds, but were still folded, crinkled, or for Quercus, pen- dant. At stage 5, leaves were unfolded but not expanded. Species and treatment comparisons were made using dates of BB (stage 4 leaf emergence), estimated by interpolation from graphs of mean bud stage as a function of time for each species and treatment."gutterman CRC,Ghelardini_2014_BMCPlantBio.pdf,,2014,,,,,,,,,,qtlmapping,n,n,y,Salix spp.,"Bud burst, defined as in Experiment 1, was assessed twice a week during April and May 2009 and 2010. Date of bud burst and date of apex abscission were expressed as day of the year (DOY), i.e. number of days since January 1."gutterman88,Gutterman_1988_BotGazette.pdf,Gutterman,1998,"Flowering Affected by Daylength and Temperature in the Leafless Flowering Desert Geophyte Colchicum tunicatum, Its Annual Life Cycle and Vegetative Propagation",Botanical Gazette,149,382-390,,"EMW started, TS continued","Table 2, Fig 11",Figure 8 looks good,https://books.google.com/books?id=ZcTP7Kb01NAC&pg=PA242&lpg=PA242&dq=GUTTERMAn+and+BOEKEN+1986&source=bl&ots=b89jBmwGiS&sig=vlRUdNRSmkWMoOgJ0HyE-HByCOY&hl=en&sa=X&ei=lJOZVI-ZA5DGsQSywoCIDw&ved=0CCIQ6AEwAg#v=onepage&q=GUTTERMAn%20and%20BOEKEN%201986&f=false,percentflowering,e,y,flower,Colchicum tunicatum,hackett74,,Hackett,1974,Environmental factors affecting flowering in Pelargonium domesticum cultivars,J Am Soc Hort Sci ,99,15-17,,,,,,,,,,,hakkinen98,Hakkinen_1998_TreePhysiol.pdf,,1998,,,,,,,,"Looking at dormancy, not a great match.",,stageofdormancy,n,m,y,Betula pendula,hall61,,"Hall IV, Ludwig RA",1961,The effect of photoperiod on the growth and flowering of the highbush blueberry (Vaccinium corymbosum L.),Can J Bot,39,1733-1739,,,,ILL request,,,,,,,hamann01,Hamann_2001_ForestrySciences.pdf,,2001,,,,,,,,"In situ and more about genetics, not good match.",,"daystobudburst, growthrate",n,m,y,Alnus rubra,Monthly height measurements from 100 trees for each of the 65 provenances over the period of one year were evaluated to examine differences in growth patterns among provenances during the second growing season. Abscission of the top five leaves and bud break of the top five buds was recorded in weekly intervals at the end of the first growing season and the beginning of the second growing season. The average day of bud break and the average date of leaf abscission were calculated as weighted averages for individual trees from these repeated measurements.hannerz99,Hannerz_1999_CanJForRes.pdf,,1999,,,,,,,,Growth stage rubric detailed on page 11.,,"forcingunits, temperaturesum",n,y,y,Picea abies,"Dormant budsBuds slightly swollen, needles below buds bent backwards and outwards Buds swollen, green to grey-green in colour, bud scales still closedBurst of bud scales, tips of needles emergingFirst elongation of needles to about double bud lengthFirst spread of needles, buds have now the appearance of a painter’s brush Elongation of shoot, basal needles not yet spreadDifferentiation of shoot, basal needles spreadAll needles more or less spread, new buds developing"